report_id,site_name,page,pottery,typology,term_found,term_found_normalized_en,quantity,start_date,end_date,date_method,context_label,pot_name_certainty_level,pot_name_llm_reasoning,pot_presence_certainty_level,pot_presence_llm_reasoning,dates_certainty_level,date_llm_reasoning,overall_certainty_level,original_text
12716,Heerlen,18,White-firing pottery,,witbakkend aardewerk,White-firing pottery,1,-12,450,period_term,present,3,The ware is described as white-firing (witbakkend) but its identification as Roman is explicitly uncertain.,9,"Explicitly found in boring 1 at 60 cm depth, assigned find number 1.",8,period word in the find's own quote,7,"In boring 1 werd op een diepte van 60 cm -mv, werd een zeer klein fragment witbakkend aardewerk gevonden (vondstnr. 1). Mogelijk ging het om een stukje Romeins aardewerk, maar dit viel niet met zekerheid vast te stellen."
12716,Heerlen,18,Painted ware,,Romeins geverfd aardewerk,Painted ware,1,-12,450,claude_text,present,8,"Explicitly described as Roman painted ware (Romeins geverfd aardewerk), vondstnr. 5.",9,"Explicitly found in boring 2 at 70-80 cm depth, assigned find number 5.",8,date read from the passage,8,In boring 2 werden op een diepte van 70-80 cm -mv en op een diepte van 150-160 cm -mv fragmenten Romeins geverfd aardewerk aangetroffen (vondstnrs. 5 en 10).
12716,Heerlen,18,Painted ware,,Romeins geverfd aardewerk,Painted ware,1,-12,450,claude_text,present,8,"Explicitly described as Roman painted ware (Romeins geverfd aardewerk), vondstnr. 10.",9,"Explicitly found in boring 2 at 150-160 cm depth, assigned find number 10.",8,date read from the passage,8,In boring 2 werden op een diepte van 70-80 cm -mv en op een diepte van 150-160 cm -mv fragmenten Romeins geverfd aardewerk aangetroffen (vondstnrs. 5 en 10).
12716,Heerlen,18,Handmade pottery,,handgevormd aardewerk in prehistorische techniek,Handmade pottery,1,-2000,450,claude_text,present,8,Explicitly described as handmade pottery in prehistoric technique.,9,"Explicitly found in boring 2 at 80 cm depth, assigned find number 4.",8,date read from the passage,8,"een stukje handgevormd aardewerk in prehistorische techniek aangetroffen (vondstnr. 4, datering: bronstijd-Romeinse periode)"
12716,Heerlen,18,Red-firing pottery,,roodbakkend aardewerk,Red-firing pottery,1,-12,450,period_term,present,4,"Described as red-firing pottery, identification as Roman is explicitly hedged with 'mogelijk'.",9,"Explicitly found in boring 2 at 175-180 cm depth, assigned find number 12.",8,period word in the find's own quote,7,Op een diepte van 175-180 cm -mv werd ook een fragment roodbakkend aardewerk aangetroffen dat -mogelijk- uit de Romeinse periode stamt (vondstnr. 12).
12716,Heerlen,16,Turned pottery,,Romeins gedraaid aardewerk,Turned pottery,,-12,450,claude_text,present,0,"general mention that pottery occurs at the site, not a discrete object",5,"Found ca. 40 m north of the study area, not within the plangebied itself — nearby find referenced in bureau research.",8,date read from the passage,4,Op ca. 40 m ten noorden van het plangebied is tijdens graafwerken in de jaren '80 Romeins gedraaid aardewerk en terra sigillata aangetroffen (ARCHIS-waarnemingsnr. 15897).
12716,Heerlen,16,Terra sigillata,,terra sigillata,Terra sigillata,,-12,450,claude_text,present,0,"general mention that pottery occurs at the site, not a discrete object",5,"Found ca. 40 m north of the study area, referenced in bureau research as a nearby observation.",8,date read from the passage,4,Op ca. 40 m ten noorden van het plangebied is tijdens graafwerken in de jaren '80 Romeins gedraaid aardewerk en terra sigillata aangetroffen (ARCHIS-waarnemingsnr. 15897).
