report_id,site_name,page,pottery,typology,term_found,term_found_normalized_en,quantity,start_date,end_date,date_method,context_label,pot_name_certainty_level,pot_name_llm_reasoning,pot_presence_certainty_level,pot_presence_llm_reasoning,dates_certainty_level,date_llm_reasoning,overall_certainty_level,original_text
12703,196530,208,Terra sigillata,,Terra sigillata,Terra sigillata,,,,claude,present,0,"general mention that pottery occurs at the site, not a discrete object",8,"Appendix IX is dedicated to terra sigillata found at the Thermenterrein in Heerlen, confirming recovery.",0,no date stated,3,Terra sigillata van het thermenterrein in Heerlen - R.A.J. Niemeijer en M. Polak
12703,196530,208,Pottery,,Het Romeinse aardewerk,Pottery,,-12,450,claude_text,present,0,"general mention that pottery occurs at the site, not a discrete object",8,"Appendix VIII is dedicated to Roman pottery found at the Thermenterrein, confirming recovery.",8,date read from the passage,5,Het Romeinse aardewerk van het Heerlense thermenterrein - J. Van Kerckhove
12703,198000,137,The Rhineland granular grey ware,,The Rhineland granular grey ware,The Rhineland granular grey ware,,40,40,rules+claude_confirmed,present,6,rule candidate; name from ware match,8,rule candidate confirmed present by claude (5c),6,"date from the rule detector, presence confirmed",7,"The
Rhineland granular grey ware form types found
occur mainly at the castella of Oberaden and, to a
lesser extent, Hofheim."
12703,198000,138,Rhineland ware,,Rhineland ware,Rhineland ware,,-12,450,rules+claude_confirmed,present,6,rule candidate; name from ware match,7,rule candidate confirmed present by claude (5c),6,"date from the rule detector, presence confirmed",6,"Products continued to
be imported from the Mediterranean region
(amphorae, mortaria, colour-coated ware
from Lyon), but Rhineland ware also comes to
occupy a prominent position in the spectrum."
12703,198000,139,Terra nigra cup,Camulodunum 120,Camulodunum 120,Terra nigra cup,,-20,40,rules+claude_confirmed,present,8,rule candidate; name from typology code,8,rule candidate confirmed present by claude (5c),8,dated from typology code (only as certain as the identification),8,"In the period between c. 120 and 175, too, the majority of the pottery consists of Heerlen
ware."
12703,198000,140,Eifel ware,,Eifel ware,Eifel ware,,101,200,rules+claude_confirmed,present,6,rule candidate; name from ware match,8,rule candidate confirmed present by claude (5c),6,"date from the rule detector, presence confirmed",7,"The third and fourth centuries AD
As in Cologne, from the end of the second
century the local ware declined in importance
in favour of Mosel and Eifel ware."
