report_id,site_name,page,pottery,typology,term_found,term_found_normalized_en,quantity,start_date,end_date,date_method,context_label,pot_name_certainty_level,pot_name_llm_reasoning,pot_presence_certainty_level,pot_presence_llm_reasoning,dates_certainty_level,date_llm_reasoning,overall_certainty_level,original_text,std_vocabulary,std_ware_code,std_ware_label,std_form_code,std_form_label,std_combined_code,std_combined_label
12751,Aarle-Rixtel,1,Urn,,urn,Urn,1,,,claude,present,7,"Described as an urn with finger-tip impressions and smeared surface, consistent with a prehistoric urn.",6,Found by a private individual but not handed over to authorities; existence reported second-hand.,0,no date stated,4,"een zijner kennissen in het be2it is van een oude urn. De pot, die door de heer Bos werd opge-dolven ... schijnt een hoogte te hebben van 23 cm. met een rand-opening van 18 cm. en een grootste wijdte van 14 cm. De rand moet versierd zijn met vingertopindrukken, terwijl het oppervlak van de pot besmeten is.",,,,,,,
12751,Echt,1,Urn,,urn,Urn,1,,,claude,present,9,Explicitly described as an urn filled with cremation remains.,9,Explicitly found at the site near Echt.,0,no date stated,6,"werd een mooi ge-vormde dunwandige, weinig en fijn gemager-de grijsblauwe en hardgebakken urn aan-getroffen, die geheel gevuld was met crematie-resten.",ABR,DUN,dunwandig aardewerk,,,,
12751,Echt,1,Beaker,,Romeins bekertje,Beaker,1,-12,450,claude_text,present,9,Explicitly named as a Roman beaker (Romeins bekertje).,9,Explicitly found on the same terrain at Echt.,8,date read from the passage,9,"Reeds vroeger werd op hetzelfde terrein een Romeins bekertje aan-getroffen, alsmede ander Romeins glas en aarde-werk.",ABR,,,BEKER,beker,,
12751,Echt,1,Roman ware,,ander Romeins aardewerk,Roman ware,,-12,450,claude_text,present,0,"general mention that pottery occurs at the site, not a discrete object",9,Explicitly found on the same terrain at Echt.,8,date read from the passage,6,"Reeds vroeger werd op hetzelfde terrein een Romeins bekertje aan-getroffen, alsmede ander Romeins glas en aarde-werk.",,,,,,,
12751,Middelaar,1,Bell beaker,,klok-beker,Bell beaker,1,,,claude,present,4,"Identified as a bell beaker only from a photograph, hedged with 'naar de foto te oordelen'.",9,Explicitly found near the graves at Middelaar.,0,no date stated,4,Dicht bij deze graven werden drie potten gevonden. Een hiervan is naar de foto te oordelen een klok-beker.,ABR,,,BEKER,beker,,
12751,Middelaar,1,Pot,,potten,Pot,2,,,claude,present,7,"Three pots found, one identified as bell beaker, leaving two unspecified pots.",9,Explicitly found near the graves at Middelaar.,0,no date stated,5,Dicht bij deze graven werden drie potten gevonden. Een hiervan is naar de foto te oordelen een klok-beker.,,,,,,,
